{
  "applicability_rules": {
    "computed_states_count_as_available": [
      "unacceptable",
      "adequate",
      "desired"
    ],
    "missing_is_not_unacceptable": true,
    "not_applicable_excluded_from_denominator": true
  },
  "content_hash": "bc1dfa36dd1b59078e5dc3508d4a3424100588445618efae5a434e008db9cf2e",
  "contract_id": "coverage-reporting-policy-version",
  "contract_version": "0.1.0",
  "coverage_rules": {
    "method": "model-weighted-observed-evidence-v1",
    "performance_filter": null,
    "quality_gate": null
  },
  "lineage": {
    "created_at": "2026-07-16T19:00:00Z",
    "created_by": "generator.m5.task10",
    "note": "Generated editable Hover starter reporting policy.",
    "source_version_ids": []
  },
  "output_rules": {
    "formal_run_authorized": false,
    "include_full_posterior": true,
    "include_observation_trace": true,
    "include_scientific_status": true
  },
  "policy_version_id": "coverage-reporting-policy-version.hover-starter.v1",
  "source": "engineering_default"
}
